{
  "schema": 1,
  "id": "cyd-2432s028r-st7789",
  "name": "Cheap Yellow Display (ESP32-2432S028R), ST7789 panel",
  "status": "community",
  "notes": "Not yet tested by the maintainers. Taken from the widely used community TFT_eSPI setup for this panel. Try it if cyd-2432s028r leaves the screen white.",
  "chip": "esp32",
  "usb": ["1A86:7523"],
  "display": {
    "driver": "ST7789",
    "width": 240,
    "height": 320,
    "rotation": 1,
    "colourOrder": "BGR",
    "invert": false,
    "spi": { "host": "HSPI", "sclk": 14, "mosi": 13, "miso": 12, "cs": 15, "dc": 2, "rst": -1, "frequency": 55000000 },
    "backlight": { "pin": 21, "activeHigh": true, "pwm": true }
  },
  "touch": {
    "driver": "XPT2046",
    "spi": { "host": "VSPI", "sclk": 25, "mosi": 32, "miso": 39, "cs": 33 },
    "irq": 36
  },
  "led": { "red": 4, "green": 16, "blue": 17, "activeLow": true }
}
